{
  "analysis_contract_digest": "fnv1a64:0f0ddb9bf6140ec4",
  "analysis_method": "auto",
  "entries": [
    {
      "detector": "function_complexity",
      "id": "EA-cca14ede71cfb821",
      "identity": {
        "anchor": "symbol:update_cognitive_metrics"
      },
      "message": "Function `update_cognitive_metrics` has 11 branch decision points.",
      "path": "crates/auditor-ast/src/complexity.rs",
      "reason": "Source-reviewed legitimate maintained debt; no detector defect or false-positive mechanism accepted.",
      "title": "Function exceeds branch complexity budget"
    },
    {
      "detector": "too_many_parameters",
      "id": "EA-044a7cd07891a15d",
      "identity": {
        "anchor": "symbol:walk_combined"
      },
      "message": "Function `walk_combined` takes 7 parameters (> 5).",
      "path": "crates/auditor-ast/src/complexity.rs",
      "reason": "Source-reviewed legitimate maintained debt; no detector defect or false-positive mechanism accepted.",
      "title": "Function parameter list exceeds budget"
    },
    {
      "detector": "function_complexity",
      "id": "EA-8858a535733ac752",
      "identity": {
        "anchor": "symbol:is_halstead_operand"
      },
      "message": "Function `is_halstead_operand` has 13 branch decision points.",
      "path": "crates/auditor-ast/src/complexity/halstead/operands.rs",
      "reason": "Source-reviewed legitimate maintained debt; no detector defect or false-positive mechanism accepted.",
      "title": "Function exceeds branch complexity budget"
    },
    {
      "detector": "function_complexity",
      "id": "EA-ef24cef551582f18",
      "identity": {
        "anchor": "symbol:is_halstead_operator"
      },
      "message": "Function `is_halstead_operator` has 13 branch decision points.",
      "path": "crates/auditor-ast/src/complexity/halstead/operators.rs",
      "reason": "Source-reviewed legitimate maintained debt; no detector defect or false-positive mechanism accepted.",
      "title": "Function exceeds branch complexity budget"
    },
    {
      "detector": "source_duplicate_detection",
      "id": "EA-cbeaba0fac078003",
      "identity": {
        "anchor": "structural:clone:7be668c0cb9cebcd"
      },
      "message": "Clone class spans 62 normalized tokens across 2 non-overlapping occurrence(s).",
      "path": "crates/auditor-detectors/src/async_rules.rs",
      "reason": "Reviewed 2026-10-18 (operator approved): duplicate-detector false positive, finding! builder boilerplate: each detector constructs its own finding from distinct literals.",
      "title": "Normalized source clone class exceeds budget"
    },
    {
      "detector": "too_many_parameters",
      "id": "EA-ebbab354e6379d92",
      "identity": {
        "anchor": "symbol:source_duplicate_finding"
      },
      "message": "Function `source_duplicate_finding` takes 6 parameters (> 5).",
      "path": "crates/auditor-detectors/src/bloat.rs",
      "reason": "Source-reviewed legitimate maintained debt; no detector defect or false-positive mechanism accepted.",
      "title": "Function parameter list exceeds budget"
    },
    {
      "detector": "function_complexity",
      "id": "EA-e422eca036d594b8",
      "identity": {
        "anchor": "symbol:threshold_metric"
      },
      "message": "Function `threshold_metric` has 11 branch decision points.",
      "path": "crates/auditor-detectors/src/config.rs",
      "reason": "Source-reviewed legitimate maintained debt; no detector defect or false-positive mechanism accepted.",
      "title": "Function exceeds branch complexity budget"
    },
    {
      "detector": "source_duplicate_detection",
      "id": "EA-0ec567a31a4d6c94",
      "identity": {
        "anchor": "structural:clone:46d2f84a21a8625a"
      },
      "message": "Clone class spans 54 normalized tokens across 2 non-overlapping occurrence(s).",
      "path": "crates/auditor-detectors/src/correctness.rs",
      "reason": "Reviewed 2026-10-18 (operator approved): duplicate-detector false positive, per-language dispatch chain: the same if/else-if skeleton calls a different per-language rule family.",
      "title": "Normalized source clone class exceeds budget"
    },
    {
      "detector": "source_duplicate_detection",
      "id": "EA-50b1a034051b5403",
      "identity": {
        "anchor": "structural:clone:f89aa3d3a370281e"
      },
      "message": "Clone class spans 94 normalized tokens across 2 non-overlapping occurrence(s).",
      "path": "crates/auditor-detectors/src/correctness.rs",
      "reason": "Reviewed 2026-10-18 (operator approved): duplicate-detector false positive, per-language dispatch chain: the same if/else-if skeleton calls a different per-language rule family.",
      "title": "Normalized source clone class exceeds budget"
    },
    {
      "detector": "source_duplicate_detection",
      "id": "EA-c8a6ecf9a79174cd",
      "identity": {
        "anchor": "structural:clone:344737cf1eb9e1c5"
      },
      "message": "Clone class spans 53 normalized tokens across 2 non-overlapping occurrence(s).",
      "path": "crates/auditor-detectors/src/correctness.rs",
      "reason": "Reviewed 2026-10-18 (operator approved): duplicate-detector false positive, same skeleton with different predicates or types: sharing it would add indirection without removing behavior.",
      "title": "Normalized source clone class exceeds budget"
    },
    {
      "detector": "source_duplicate_detection",
      "id": "EA-128ec0e2b824a2b0",
      "identity": {
        "anchor": "structural:clone:cbbe501ede7ec5a2"
      },
      "message": "Clone class spans 55 normalized tokens across 2 non-overlapping occurrence(s).",
      "path": "crates/auditor-detectors/src/csharp_api_rules.rs",
      "reason": "Reviewed 2026-10-18 (operator approved): duplicate-detector false positive, same skeleton with different predicates or types: sharing it would add indirection without removing behavior.",
      "title": "Normalized source clone class exceeds budget"
    },
    {
      "detector": "source_duplicate_detection",
      "id": "EA-913432e438ab5278",
      "identity": {
        "anchor": "structural:clone:c34113cce387ac25"
      },
      "message": "Clone class spans 52 normalized tokens across 2 non-overlapping occurrence(s).",
      "path": "crates/auditor-detectors/src/csharp_api_rules.rs",
      "reason": "Reviewed 2026-10-18 (operator approved): duplicate-detector false positive, per-language mirror rule family: the same API rule over different grammar accessors (the mirror-pair convention).",
      "title": "Normalized source clone class exceeds budget"
    },
    {
      "detector": "source_duplicate_detection",
      "id": "EA-9a4370c3ac59e196",
      "identity": {
        "anchor": "structural:clone:c9421f85f39d0502"
      },
      "message": "Clone class spans 54 normalized tokens across 2 non-overlapping occurrence(s).",
      "path": "crates/auditor-detectors/src/csharp_api_rules.rs",
      "reason": "Reviewed 2026-10-18 (operator approved): duplicate-detector false positive, same skeleton with different predicates or types: sharing it would add indirection without removing behavior.",
      "title": "Normalized source clone class exceeds budget"
    },
    {
      "detector": "function_complexity",
      "id": "EA-2e3c6086a47c12b8",
      "identity": {
        "anchor": "symbol:run_optimization_owner"
      },
      "message": "Function `run_optimization_owner` has 13 branch decision points.",
      "path": "crates/auditor-detectors/src/dispatcher.rs",
      "reason": "Source-reviewed legitimate maintained debt; no detector defect or false-positive mechanism accepted.",
      "title": "Function exceeds branch complexity budget"
    },
    {
      "detector": "function_complexity",
      "id": "EA-3ba9d856758b95de",
      "identity": {
        "anchor": "symbol:run_structural_owner"
      },
      "message": "Function `run_structural_owner` has 31 branch decision points.",
      "path": "crates/auditor-detectors/src/dispatcher.rs",
      "reason": "Source-reviewed legitimate maintained debt; no detector defect or false-positive mechanism accepted.",
      "title": "Function exceeds branch complexity budget"
    },
    {
      "detector": "function_complexity",
      "id": "EA-4f2f2464ee9cac58",
      "identity": {
        "anchor": "symbol:run_foundation_owner"
      },
      "message": "Function `run_foundation_owner` has 14 branch decision points.",
      "path": "crates/auditor-detectors/src/dispatcher.rs",
      "reason": "Source-reviewed legitimate maintained debt; no detector defect or false-positive mechanism accepted.",
      "title": "Function exceeds branch complexity budget"
    },
    {
      "detector": "function_complexity",
      "id": "EA-6ac9c3311248de6f",
      "identity": {
        "anchor": "symbol:run_error_owner"
      },
      "message": "Function `run_error_owner` has 20 branch decision points.",
      "path": "crates/auditor-detectors/src/dispatcher.rs",
      "reason": "Source-reviewed legitimate maintained debt; no detector defect or false-positive mechanism accepted.",
      "title": "Function exceeds branch complexity budget"
    },
    {
      "detector": "function_complexity",
      "id": "EA-8c658c3e26ffde41",
      "identity": {
        "anchor": "symbol:run_language_owner"
      },
      "message": "Function `run_language_owner` has 13 branch decision points.",
      "path": "crates/auditor-detectors/src/dispatcher.rs",
      "reason": "Source-reviewed legitimate maintained debt; no detector defect or false-positive mechanism accepted.",
      "title": "Function exceeds branch complexity budget"
    },
    {
      "detector": "function_complexity",
      "id": "EA-a0d3c4f56723095a",
      "identity": {
        "anchor": "symbol:run_correctness_owner"
      },
      "message": "Function `run_correctness_owner` has 18 branch decision points.",
      "path": "crates/auditor-detectors/src/dispatcher.rs",